{
  "Agency": "State",
  "AirPollutants": "Benzene, TOTAL PARTICULATE MATTER, FACIL",
  "AirPrograms": "CAANESH, CAASIP, CAATVP",
  "ERPType": "VA0000005151044014",
  "Mnth10Status": "No Violation Identified",
  "Mnth11Status": "No Violation Identified",
  "Mnth12Status": "No Violation Identified",
  "Mnth13Status": "No Violation Identified",
  "Mnth14Status": "No Violation Identified",
  "Mnth15Status": "No Violation Identified",
  "Mnth16Status": "No Violation Identified",
  "Mnth17Status": "No Violation Identified",
  "Mnth18Status": "No Violation Identified",
  "Mnth19Status": "No Violation Identified",
  "Mnth1Status": "No Violation Identified",
  "Mnth20Status": "No Violation Identified",
  "Mnth21Status": "No Violation Identified",
  "Mnth22Status": "No Violation Identified",
  "Mnth23Status": "No Violation Identified",
  "Mnth24Status": "No Violation Identified",
  "Mnth25Status": "No Violation Identified",
  "Mnth26Status": "No Violation Identified",
  "Mnth27Status": "No Violation Identified",
  "Mnth28Status": "No Violation Identified",
  "Mnth29Status": "No Violation Identified",
  "Mnth2Status": "No Violation Identified",
  "Mnth30Status": "No Violation Identified",
  "Mnth31Status": "No Violation Identified",
  "Mnth32Status": "No Violation Identified",
  "Mnth33Status": "No Violation Identified",
  "Mnth34Status": "No Violation Identified",
  "Mnth35Status": "No Violation Identified",
  "Mnth36Status": "No Violation Identified",
  "Mnth3Status": "No Violation Identified",
  "Mnth4Status": "No Violation Identified",
  "Mnth5Status": "No Violation Identified",
  "Mnth6Status": "No Violation Identified",
  "Mnth7Status": "No Violation Identified",
  "Mnth8Status": "No Violation Identified",
  "Mnth9Status": "No Violation Identified",
  "Qtr10Status": "No Viol",
  "Qtr11Status": "No Viol",
  "Qtr12Status": "No Viol",
  "Qtr1Status": "No Viol",
  "Qtr2Status": "No Viol",
  "Qtr3Status": "No Viol",
  "Qtr4Status": "No Viol",
  "Qtr5Status": "No Viol",
  "Qtr6Status": "No Viol",
  "Qtr7Status": "No Viol",
  "Qtr8Status": "No Viol",
  "Qtr9Status": "No Viol",
  "SourceID": "ALR040033"
}